<?xml version="1.0" encoding="UTF-8"?>

<!-- New XML document created with EditiX XML Editor (http://www.editix.com) at Wed Nov 14 15:11:17 CET 2018 -->

<?xml-stylesheet href="movie.css" type="text/css"?>

<!DOCTYPE movies SYSTEM "movie.dtd">
<movies>
	<movie id="1">
		<title>
	Les Brigades du Tigre
	</title>
		<kind>
	Thriller
	</kind>
		<duration>
	(2h 5min)
	</duration>
		<moviemaker lang="fr">
	Jérôme Cornuau
	</moviemaker>
		<language>
	VF(en  French)
	</language>
		<actors>
			<actor id="1">
		C.cornillac
		</actor>
			<actor id="2">
		D.Kruger		
		</actor>
			<actor id="3">
		E.Baer
		</actor>
		</actors>
		<yearofproduction>
		Year:2005
	</yearofproduction>
		<story lang="en">
		About the adventures of commissar Valentin and inspectors Terrasson and Pujol,
members of the " Brigades mobiles", special squad of the French police before
the first world war
	</story>
		<rating>
			<press>
			Press :3/5
	</press>
			<speces>
			Spectators :4/5
	</speces>
		</rating>
		<schedules>
			<schedule id="1">
		Wed, Sat : 14:00 | 16:40 | 19:40 | 22:10
		</schedule>
			<schedule id="2">
		Tue, Fri, Mon, Thu : 14:00 | 19:40 | 22:10
		</schedule>
			<schedule id="3">
		Sun : 10:20 | 14:00 | 16:40 | 20:20
		</schedule>
		</schedules>
	</movie>
	<movie id="2">
		<title>
	Avengers
	</title>
		<kind>
	super-heros 
	</kind>
		<duration>
	(2h 22min)
	</duration>
		<moviemaker lang="en">
	 Joss Whedon
	</moviemaker>
		<language>
	(en  Anglais)
	</language>
		<actors>
			<actor id="1">
		Robert Downey Jr
		</actor>
			<actor id="2">
		Chris Evans		
		</actor>
			<actor id="3">
		 Chris Hemsworth
		</actor>
			<actor id="4">
		 Scarlett Johansson	
		</actor>
		</actors>
		<yearofproduction>
		Year:2012
	</yearofproduction>
		<story lang="fr">
		 Il se base sur l'équipe de super-héros du même nom (Les Vengeurs en français) apparaissant dans le comic book publié par Marvel Comics et constitue le sixième film de l'univers cinématographique Marvel
	</story>
		<rating>
			<press>
			Press :3/5
	</press>
			<speces>
			Spectators :4/5
	</speces>
		</rating>
		<schedules>
			<schedule id="1">
		Wed, Sat : 14:00 | 16:40 | 19:40 | 22:10
		</schedule>
			<schedule id="2">
		Tue, Fri, Mon, Thu : 14:00 | 19:40 | 22:10
		</schedule>
			<schedule id="3">
		Sun : 10:20 | 14:00 | 16:40 | 20:20
		</schedule>
		</schedules>
	</movie>
</movies>
